<?xml version="1.0" encoding="UTF-8"?>
<VendorCV xmlns="http://www.bidib.org/jbidibc/vendorcv" xmlns:xsi="http://www.w3.org/2001/XMLSchema-instance" xsi:schemaLocation="http://www.bidib.org/vendorcv vendor_cv.xsd">
    <Version version="0.1" LastUpdate="20130515" author="BiDiB-Mustermann" PID1="107" PID2="000" Vendor="013" description="BiDiB-s88-Bridge"/>
    <CVDefinition>
        <Basis>
            <CV number="1" type="Byte" min="0" max="255" low="-" high="-" values="-" mode="ro" descde="vendor_id" descen="vendor_id"/>
            <CV number="2" type="Byte" min="0" max="255" low="-" high="-" values="-" mode="ro" descde="hw_id" descen="hw_id"/>
            <CV number="3" type="Int" min="0" max="255" low="3" high="4" values="-" mode="rw" descde="hw_serial_low" descen="hw_serial_low"/>
            <CV number="4" type="Int" min="0" max="255" low="3" high="4" values="-" mode="rw" descde="hw_serial_high" descen="hw_serial_high"/>
            <CV number="5" type="Byte" min="-" max="-" low="-" high="-" values="2;4;6;8;10;12;16" mode="rw" descde="s88_size" descen="s88_size"/>
            <CV number="6" type="Byte" min="0" max="255" low="-" high="-" values="-" mode="rw" descde="s88_clk_timing" descen="s88_clk_timing"/>
        </Basis>
    </CVDefinition>
</VendorCV>
